<?xml version="1.0" ?>
<?xml-stylesheet type="text/xsl" href="../XSL/Stylesheet.xsl"?>

<!DOCTYPE planifications SYSTEM "../DTD/planification.dtd" >

<planifications>
	<movie>
		<name>Transformers</name>
		<schedule>
			<location room="1">Flon</location>
			<date>12.03.2014</date>
			<hour>15.00</hour>
		</schedule>
	</movie>
	<movie>
		<name>Equilibrium</name>
		<schedule>
			<location room="2">Galerie</location>
			<date>12.03.2014</date>
			<hour>17.00</hour>
		</schedule>
	</movie>
	<movie>
		<name>American Outlaws</name>
		<schedule>
			<location room="1">Flon</location>
			<date>12.03.2014</date>
			<hour>18.00</hour>
		</schedule>
	</movie>
</planifications>